url,name,summary,category_id
https://github.com/simonw/sqlite-utils,sqlite-utils,"Python CLI utility and library for manipulating SQLite databases.",utilities
https://github.com/simonw/datasette,datasette,"An open source multi-tool for exploring and publishing data.",utilities
https://github.com/dpapathanasiou/simple-graph,simple-graph,A graph database in SQLite inspired by 'SQLite as a document database'.,application
https://github.com/rqlite/rqlite,rqlite,"A distributed relational database.",utilities
https://github.com/inukshuk/sqleton,sqleton,A tool to visualise SQLite database schemas.,utilities
https://github.com/cldellow/sqlite-parquet-vtable,sqlite-parquet-vtable,A SQLite virtual table extension to expose Parquet files as SQL tables.,extensions
